{
  "task_snapshot": {
    "objective": "Review a bounded change.",
    "scope": [
      "Named files only."
    ],
    "acceptance_criteria": [
      "Review findings cite lines."
    ],
    "risk_level": "low",
    "side_effects": "none",
    "evidence_refs": [
      "runtime-catalog"
    ],
    "stop_conditions": [
      "Stop on scope expansion."
    ]
  },
  "task_class": "research_strategy",
  "requested_model": "gpt-6-astra",
  "requested_thinking": "high",
  "resolved_model": "gpt-6-astra",
  "resolved_thinking": "high",
  "capability_snapshot_digest": "sha256:4d62b51aacc3936c5f7950882761cadc82c9823d00ed45d66dde364b3d4abe5a",
  "route_source": "selected",
  "routing_mode": "direct",
  "evidence_state": "runtime_observation",
  "execution_level": "worker",
  "worker_kind": "subagent",
  "fork_turns": "none",
  "delegation_depth": 1,
  "nested_delegation": false,
  "fanout": {
    "requested_workers": 1,
    "independent": true,
    "deterministic": true,
    "noncolliding": true,
    "active_workers": 0
  },
  "rationale": "Demanding end-to-end work requires sustained judgment.",
  "quality_gate": "Every finding cites an exact source location.",
  "escalate_when": [
    "The evidence is incomplete."
  ],
  "authority": {
    "ceiling": "none",
    "allowed_actions": [
      "read",
      "analyze"
    ],
    "prohibited_actions": [
      "external_send",
      "production_write",
      "merge",
      "deploy",
      "publish",
      "credential_change",
      "irreversible_action",
      "authority_widening"
    ],
    "allowed": [
      "Read named local files."
    ],
    "prohibited": [
      "Edit, send, or deploy."
    ],
    "proof_required": [
      "Return line references."
    ],
    "stop_conditions": [
      "Stop on scope expansion."
    ]
  }
}
