{
  "task_snapshot": {
    "objective": "Continue the inherited bounded route.",
    "scope": [
      "Named files only."
    ],
    "acceptance_criteria": [
      "Focused tests pass."
    ],
    "risk_level": "low",
    "side_effects": "local_reversible",
    "evidence_refs": [
      "parent-route"
    ],
    "stop_conditions": [
      "Stop if the route must change."
    ]
  },
  "task_class": "coding",
  "requested_model": "gpt-5.6-sol",
  "requested_thinking": "medium",
  "resolved_model": "gpt-5.6-sol",
  "resolved_thinking": "medium",
  "capability_snapshot_digest": "sha256:4d62b51aacc3936c5f7950882761cadc82c9823d00ed45d66dde364b3d4abe5a",
  "route_source": "inherited",
  "parent_route": {
    "model": "gpt-5.6-sol",
    "thinking": "medium",
    "capability_snapshot_digest": "sha256:4d62b51aacc3936c5f7950882761cadc82c9823d00ed45d66dde364b3d4abe5a"
  },
  "routing_mode": "direct",
  "evidence_state": "runtime_observation",
  "execution_level": "worker",
  "worker_kind": "subagent",
  "fork_turns": "all",
  "delegation_depth": 1,
  "nested_delegation": false,
  "fanout": {
    "requested_workers": 1,
    "independent": true,
    "deterministic": true,
    "noncolliding": true,
    "active_workers": 0
  },
  "rationale": "Full-history inheritance preserves the parent route exactly.",
  "quality_gate": "Focused tests pass.",
  "escalate_when": [
    "A different route is required."
  ],
  "authority": {
    "ceiling": "local_reversible",
    "allowed_actions": [
      "read",
      "analyze",
      "test",
      "local_reversible_edit"
    ],
    "prohibited_actions": [
      "external_send",
      "production_write",
      "merge",
      "deploy",
      "publish",
      "credential_change",
      "irreversible_action",
      "authority_widening"
    ],
    "allowed": [
      "Edit named local files."
    ],
    "prohibited": [
      "Deploy or publish."
    ],
    "proof_required": [
      "Return test output."
    ],
    "stop_conditions": [
      "Stop if the route must change."
    ]
  }
}
