{
  "task_snapshot": {
    "objective": "Complete the bounded tool workflow with passing tests.",
    "scope": [
      "Edit the named module.",
      "Update focused tests."
    ],
    "acceptance_criteria": [
      "Targeted and project verification pass."
    ],
    "risk_level": "low",
    "side_effects": "local_reversible",
    "evidence_refs": [
      "routing-receipts/bounded-tool-work.json"
    ],
    "stop_conditions": [
      "Stop if the API contract must change."
    ]
  },
  "task_class": "coding",
  "requested_model": "gpt-5.6-terra",
  "requested_thinking": "high",
  "resolved_model": "gpt-5.6-terra",
  "resolved_thinking": "high",
  "model": "gpt-5.6-terra",
  "thinking": "high",
  "capability_snapshot_digest": "sha256:4d62b51aacc3936c5f7950882761cadc82c9823d00ed45d66dde364b3d4abe5a",
  "route_source": "selected",
  "routing_mode": "probe_then_escalate",
  "evidence_state": "official_guidance",
  "execution_level": "worker",
  "worker_kind": "subagent",
  "fork_turns": "none",
  "delegation_depth": 1,
  "nested_delegation": false,
  "fanout": {
    "requested_workers": 1,
    "independent": true,
    "deterministic": true,
    "noncolliding": true,
    "active_workers": 0
  },
  "rationale": "Repeated personal evals show Terra completes this bounded tool workflow faster than passing Luna and Sol routes.",
  "quality_gate": "The targeted regression test and project verification pass.",
  "escalate_when": [
    "The requested API contract must change."
  ],
  "authority": {
    "ceiling": "local_reversible",
    "allowed_actions": [
      "read",
      "analyze",
      "test",
      "local_reversible_edit"
    ],
    "prohibited_actions": [
      "external_send",
      "production_write",
      "merge",
      "deploy",
      "publish",
      "credential_change",
      "irreversible_action",
      "authority_widening"
    ],
    "allowed": [
      "Edit the named module and its tests."
    ],
    "prohibited": [
      "Merge, deploy, or change production configuration."
    ],
    "proof_required": [
      "Return the exact test commands and outcomes."
    ],
    "stop_conditions": [
      "Stop after two failed attempts with the same symptom."
    ]
  },
  "trial": {
    "deterministic_verification": true,
    "safe_retry": true
  },
  "escalation_route": {
    "model": "gpt-5.6-sol",
    "thinking": "medium"
  }
}
