{
  "task_snapshot": {
    "objective": "Transform the supplied fixture into validated JSON.",
    "scope": [
      "Read one fixture.",
      "Return one transformed artifact."
    ],
    "acceptance_criteria": [
      "Every input record appears exactly once."
    ],
    "risk_level": "low",
    "side_effects": "none",
    "evidence_refs": [
      "fixture-contract"
    ],
    "stop_conditions": [
      "Stop if the input cannot be parsed."
    ]
  },
  "task_class": "transformation",
  "requested_model": "gpt-5.6-luna",
  "requested_thinking": "max",
  "resolved_model": "gpt-5.6-luna",
  "resolved_thinking": "max",
  "model": "gpt-5.6-luna",
  "thinking": "max",
  "capability_snapshot_digest": "sha256:4d62b51aacc3936c5f7950882761cadc82c9823d00ed45d66dde364b3d4abe5a",
  "route_source": "selected",
  "routing_mode": "probe_then_escalate",
  "evidence_state": "official_guidance",
  "execution_level": "worker",
  "worker_kind": "subagent",
  "fork_turns": "none",
  "delegation_depth": 1,
  "nested_delegation": false,
  "fanout": {
    "requested_workers": 1,
    "independent": true,
    "deterministic": true,
    "noncolliding": true,
    "active_workers": 0
  },
  "rationale": "The task is specific, repeatable, and has a deterministic output.",
  "quality_gate": "Every input record appears exactly once in valid JSON.",
  "escalate_when": [
    "Acceptance fails after at most one useful targeted correction; missing source evidence stops escalation."
  ],
  "escalation_route": {
    "model": "gpt-5.6-sol",
    "thinking": "xhigh"
  },
  "authority": {
    "ceiling": "none",
    "allowed_actions": [
      "read",
      "analyze"
    ],
    "prohibited_actions": [
      "external_send",
      "production_write",
      "merge",
      "deploy",
      "publish",
      "credential_change",
      "irreversible_action",
      "authority_widening"
    ],
    "allowed": [
      "Read the supplied fixture and return transformed JSON."
    ],
    "prohibited": [
      "Edit source files or contact external services."
    ],
    "proof_required": [
      "Report input and output record counts."
    ],
    "stop_conditions": [
      "Stop if the input cannot be parsed."
    ]
  }
}
