{
  "task_snapshot": {
    "objective": "Resolve the indivisible high-value decision.",
    "scope": [
      "Read approved evidence.",
      "Produce one decision memo."
    ],
    "acceptance_criteria": [
      "Every stated tradeoff is resolved with cited evidence."
    ],
    "risk_level": "high",
    "side_effects": "none",
    "evidence_refs": [
      "approved-primary-sources"
    ],
    "stop_conditions": [
      "Stop if required owner intent is missing."
    ]
  },
  "task_class": "research_strategy",
  "requested_model": "gpt-5.6-sol",
  "requested_thinking": "max",
  "resolved_model": "gpt-5.6-sol",
  "resolved_thinking": "max",
  "model": "gpt-5.6-sol",
  "thinking": "max",
  "capability_snapshot_digest": "sha256:4d62b51aacc3936c5f7950882761cadc82c9823d00ed45d66dde364b3d4abe5a",
  "route_source": "selected",
  "routing_mode": "direct",
  "evidence_state": "official_guidance",
  "execution_level": "root",
  "worker_kind": "durable_thread",
  "fork_turns": "none",
  "delegation_depth": 0,
  "nested_delegation": false,
  "fanout": {
    "requested_workers": 0,
    "independent": false,
    "deterministic": false,
    "noncolliding": false,
    "active_workers": 0
  },
  "rationale": "The decision is unusually difficult, high value, and cannot be decomposed safely.",
  "quality_gate": "The recommendation resolves every stated tradeoff with cited evidence.",
  "escalate_when": [
    "A required primary source is inaccessible."
  ],
  "authority": {
    "ceiling": "none",
    "allowed_actions": [
      "read",
      "analyze",
      "durable_thread_control"
    ],
    "prohibited_actions": [
      "external_send",
      "production_write",
      "merge",
      "deploy",
      "publish",
      "credential_change",
      "irreversible_action",
      "authority_widening"
    ],
    "allowed": [
      "Read approved sources and produce a decision memo."
    ],
    "prohibited": [
      "Purchase, publish, or send anything."
    ],
    "proof_required": [
      "Cite every material current claim."
    ],
    "stop_conditions": [
      "Stop if the decision depends on missing owner intent."
    ]
  }
}
